,correct_sentence,wrong_sentence
11818,"밥을 먹으러, 식당에 갔다.","밥을먹으러,식당에갔다."
11819,"밥을 먹으러, 열심히 공부한다.","밥을먹으러,열심히공부한다."
11820,도무지 이것은 딴판이다.,도무지이것은딴판이다.
11821,도저히 이것은 딴판이다.,도저히이것은딴판이다.
11822,그는 사과를 먹었음직하다.,그는사과를먹었음직하다.
11823,그는 사과를 먹었음직하겠다.,그는사과를먹었음직하겠다.
11824,밥을 먹고 싶지만 여러 가지 사정으로 안 먹겠다.,밥을먹고싶지만여러가지사정으로안먹겠다.
11825,그 일을 하겠지만 여러 가지 사정으로 안 하겠다.,그일을하겠지만여러가지사정으로안하겠다.
11826,집안은 무고하신지요?,집안은무고하신지요?
11827,집안에 무슨 일 있으신지요?,집안에무슨일있으신지요?
11828,팔을 영수는 형이 다쳤다.,팔을영수는형이다쳤다.
11829,아버님은 옥상에 올라가 보셨다.,아버님은옥상에올라가보셨다.
11830,아버님은 옥상에 보셨다.,아버님은옥상에보셨다.
11831,"내 사람이다 하고 살다 보면, 정은 들게 마련이다.","내사람이다하고살다보면,정은들게마련이다."
11832,"네가 내 사람이다 하고 살다 내가 보면, 정은 들게 마련이다.","네가내사람이다하고살다내가보면,정은들게마련이다."
11833,철수는 신문을 읽어 보았다.,철수는신문을읽어보았다.
11834,신문을 읽어 철수는 보았다.,신문을읽어철수는보았다.
11835,네가 어저께 나무에 부딪치더구나.,네가어저께나무에부딪치더구나.
11836,내가 어저께 나무에 부딪치더구나.,내가어저께나무에부딪치더구나.
11837,어느 사회든 바람직하지 못한 말들이 있음은 사실이다.,어느사회든바람직하지못한말들이있음은사실이다.
11838,어느 사회든 바람직하지 못한 말들이 있기는 사실이다.,어느사회든바람직하지못한말들이있기는사실이다.
11839,나는 철수가 한국을 떠남이 슬프다.,나는철수가한국을떠남이슬프다.
11840,나는 철수가 한국을 떠나기가 슬프다.,나는철수가한국을떠나기가슬프다.
11841,"대학교의 교실, 중학교의 교실, 국민학교의 교실이 각각 크기가 같다.","대학교의교실,중학교의교실,국민학교의교실이각각크기가같다."
11842,"대학교의, 중학교의, 국민학교의 교실이 각각 크기가 같다.","대학교의,중학교의,국민학교의교실이각각크기가같다."
11843,그는 끝까지 항쟁을 했을지언정 항복하지는 않았을 것이다.,그는끝까지항쟁을했을지언정항복하지는않았을것이다.
11844,그는 끝까지 항쟁을 했을지언정 항복하지는 않겠다.,그는끝까지항쟁을했을지언정항복하지는않겠다.
11845,내가 그리로 가나 보구나.,내가그리로가나보구나.
11846,내가 그리로 가나 보구려.,내가그리로가나보구려.
11847,덥지요? 선풍기 조금 틀까요?,덥지요?선풍기조금틀까요?
11848,덥지요? 선풍기 조금만 틀까요?,덥지요?선풍기조금만틀까요?
11849,나는 집에 안 갈까 한다.,나는집에안갈까한다.
11850,나는 집에 갈까 안 한다.,나는집에갈까안한다.
11851,전에 경기를 본 적이 있었는데 우리 팀이 이길 것이다.,전에경기를본적이있었는데우리팀이이길것이다.
11852,전에 경기를 본 적이 있었는데 우리 팀이 이기겠다.,전에경기를본적이있었는데우리팀이이기겠다.
11853,저 애가 공부도 잘 했답니다.,저애가공부도잘했답니다.
11854,저 애가 공부도 잘 하겠답니다.,저애가공부도잘하겠답니다.
11855,그는 아버지를 이해하고 그를 사랑했다.,그는아버지를이해하고그를사랑했다.
11856,내가 그리로 가나 싶구나.,내가그리로가나싶구나.
11857,내가 그리로 가나 싶자.,내가그리로가나싶자.
11858,사모님의 고통이 커질수록 선생님도 고통이 커졌다.,사모님의고통이커질수록선생님도고통이커졌다.
11859,사모님의 고통이 커지실수록 선생님도 고통이 커졌다.,사모님의고통이커지실수록선생님도고통이커졌다.
11860,우리 집은 마당이 좁다.,우리집은마당이좁다.
11861,마당이 우리 집은 좁다.,마당이우리집은좁다.
11862,아버지가 큰딸에게 남다른 사랑을 주었다.,아버지가큰딸에게남다른사랑을주었다.
11863,아버지가 큰딸을 남다른 사랑을 주었다.,아버지가큰딸을남다른사랑을주었다.
11864,철수는 작은 고추가 맵다고 생각한다.,철수는작은고추가맵다고생각한다.
11865,철수는 작은 고추를 맵다고 생각한다.,철수는작은고추를맵다고생각한다.
11866,언제 들어도 좋은 곡이었다.,언제들어도좋은곡이었다.
11867,언제 들었어도 좋은 곡이었다.,언제들었어도좋은곡이었다.
11868,쟤는 뭘 하든지 느려 터졌다.,쟤는뭘하든지느려터졌다.
11869,쟤는 뭘 하든지 느려 터진다.,쟤는뭘하든지느려터진다.
11870,그는 바지를 머리에 썼다.,그는바지를머리에썼다.
11871,그는 바지를 머리에 입었다.,그는바지를머리에입었다.
11872,길바닥에 넘어진 꼬마는 일어날 생각도 않고 눈물만 쥐어짜고 있었다.,길바닥에넘어진꼬마는일어날생각도않고눈물만쥐어짜고있었다.
11873,길바닥에 넘어진 꼬마는 일어날 생각도 않고 눈물만 쥐어서 짜고 있었다.,길바닥에넘어진꼬마는일어날생각도않고눈물만쥐어서짜고있었다.
11874,빨주노초파남보 중 어떤 색깔이 마음에 드니?,빨주노초파남보중어떤색깔이마음에드니?
11875,빨주노초파남보 중 어떠한 색깔이 마음에 드니?,빨주노초파남보중어떠한색깔이마음에드니?
11876,이웃의 도움으로 인해 아이들이 희생을 안 당했다.,이웃의도움으로인해아이들이희생을안당했다.
11877,이웃의 도움으로 인해 아이들이 희생을 못 당했다.,이웃의도움으로인해아이들이희생을못당했다.
11878,그 말을 듣자마자 먹던 밥을 내던졌어요.,그말을듣자마자먹던밥을내던졌어요.
11879,그 말을 듣자마자 먹었던 밥을 내던졌어요.,그말을듣자마자먹었던밥을내던졌어요.
11880,"아이고, 양말에 구멍 났거든!","아이고,양말에구멍났거든!"
11881,돌아오지 않은 사람이 돌아온 사람 많았다.,돌아오지않은사람이돌아온사람많았다.
11882,그 에어컨은 자동 온도 조절 장치가 없다.,그에어컨은자동온도조절장치가없다.
11883,그 에어컨은 자동 온도 조절 장치가 안 있다.,그에어컨은자동온도조절장치가안있다.
11884,병화가 간 곳은 원삼이 집이다.,병화가간곳은원삼이집이다.
11885,병화가 간 곳은 원삼이 집에이다.,병화가간곳은원삼이집에이다.
11886,집에서 학교로 재영이는 갔다.,집에서학교로재영이는갔다.
11887,학교로 집에서 재영이는 갔다.,학교로집에서재영이는갔다.
11888,시은이가 국수 비빔을 하였다.,시은이가국수비빔을하였다.
11889,시은이가 국수를 비빔하였다.,시은이가국수를비빔하였다.
11890,반가운 손님이 오기에 버선발로 달려 나갔다.,반가운손님이오기에버선발로달려나갔다.
11891,어제 보니 영희는 살이 많이 쪘네.,어제보니영희는살이많이쪘네.
11892,한참을 걸어 들어가도 물이 허리까지 무릎 높이까지밖에 되질 않았다.,한참을걸어들어가도물이허리까지무릎높이까지밖에되질않았다.
11893,나는 종이 접기를 못한다.,나는종이접기를못한다.
11894,나는 종이를 접기를 못한다.,나는종이를접기를못한다.
11895,나는 정은이를 친동생으로 여긴다.,나는정은이를친동생으로여긴다.
11896,나는 친동생으로 정은이를 여긴다.,나는친동생으로정은이를여긴다.
11897,철수는 눈물이 많다.,철수는눈물이많다.
11898,철수에게는 눈물이 많다.,철수에게는눈물이많다.
11899,나는 내년에 이 빈터 위에 우리 집이 지어진 모습을 상상하고 있어.,나는내년에이빈터위에우리집이지어진모습을상상하고있어.
11900,겨울비가 아주 많이 내린다.,겨울비가아주많이내린다.
11901,겨울비가 아주 내린다.,겨울비가아주내린다.
11902,어찌어찌하다 그리 됐니?,어찌어찌하다그리됐니?
11903,어찌하고 어찌하다 그리 됐니?,어찌하고어찌하다그리됐니?
11904,오전에 한 빨래가 아까부터 말랐다.,오전에한빨래가아까부터말랐다.
11905,오전에 한 빨래가 1시간 동안 말랐다.,오전에한빨래가1시간동안말랐다.
11906,김 씨는 아직 사다리를 오른다.,김씨는아직사다리를오른다.
11907,잡은 손이 떨리는 것으로 보아 여인은 울고 있음이 분명하였다.,잡은손이떨리는것으로보아여인은울고있음이분명하였다.
11908,30분 동안 잡은 손이 떨리는 것으로 보아 여인은 울고 있음이 분명하였다.,30분동안잡은손이떨리는것으로보아여인은울고있음이분명하였다.
11909,"예전에 그 집에 살던 누군가가 있었는데, 그에게는 딸이 하나 있었단다.","예전에그집에살던누군가가있었는데,그에게는딸이하나있었단다."
11910,그 애는 매우 내켜 하지 않았지만 그래도 형을 따라 나왔다.,그애는매우내켜하지않았지만그래도형을따라나왔다.
11911,그 애는 잘 내켜 하지 않았지만 그래도 형을 따라 나왔다.,그애는잘내켜하지않았지만그래도형을따라나왔다.
11912,이 집을 팔고 어찌하실려구요?,이집을팔고어찌하실려구요?
11913,이 집을 팔고 어찌 좀 하실려구요?,이집을팔고어찌좀하실려구요?
11914,가슴이 두근두근거리며 다가가다.,가슴이두근두근거리며다가가다.
11915,나는 동생에게 들어올 때 맛있는 걸 사오라고 전화했다.,나는동생에게들어올때맛있는걸사오라고전화했다.
11916,나는 동생에게 들어올 때 맛있는 걸 사올 것을 전화했다.,나는동생에게들어올때맛있는걸사올것을전화했다.
11917,"원자탄이 떨어져 봐라, 우리 다 죽지.","원자탄이떨어져봐라,우리다죽지."
11918,"원자탄이 떨어져만, 우리 다 죽지.","원자탄이떨어져만,우리다죽지."
11919,누구도 쉽게 나를 못 당할 것이다.,누구도쉽게나를못당할것이다.
11920,지난 번 회장 선거 때 우리들이 모두 그를 회장으로 밀었다.,지난번회장선거때우리들이모두그를회장으로밀었다.
11921,지난 번 회장 선거 때 그가 우리들 모두에게 회장으로 밀렸다.,지난번회장선거때그가우리들모두에게회장으로밀렸다.
11922,비행기가 부산으로는 떠났다.,비행기가부산으로는떠났다.
11923,비행기가 부산은 떠났다.,비행기가부산은떠났다.
11924,사랑을 쓰려거든 연필로 쓰세요.,사랑을쓰려거든연필로쓰세요.
11925,사랑 쓰려거든 연필로 쓰세요.,사랑쓰려거든연필로쓰세요.
11926,철수가 바다로 갔다.,철수가바다로갔다.
11927,철수가 바다로 가 있다.,철수가바다로가있다.
11928,영어책은 선반 위에 있구나.,영어책은선반위에있구나.
11929,영어 책은 선반 위에 있는구나.,영어책은선반위에있는구나.
11930,나는 아버지로부터 편지와 돈 십 원을 받았다.,나는아버지로부터편지와돈십원을받았다.
11931,나는 아버지부터 편지와 돈 십 원을 받았다.,나는아버지부터편지와돈십원을받았다.
11932,성적이 떨어졌댔자 얼마나 떨어지겠어.,성적이떨어졌댔자얼마나떨어지겠어.
11933,성적이 떨어졌대자 얼마나 떨어지겠어.,성적이떨어졌대자얼마나떨어지겠어.
11934,"그보다도, 어제 함께 왔던 아가씨는 이 둘 중에 어느 아가씨요?","그보다도,어제함께왔던아가씨는이둘중에어느아가씨요?"
11935,"그보다도, 어제 함께 왔던 아가씨는 이 둘 중에 무슨 아가씨요?","그보다도,어제함께왔던아가씨는이둘중에무슨아가씨요?"
11936,신발이 내게 잘 맞는다.,신발이내게잘맞는다.
11937,내가 신발이 잘 맞는다.,내가신발이잘맞는다.
11938,그는 진실에 대한 추구를 귀납적으로가 아니라 연역적으로 하였다.,그는진실에대한추구를귀납적으로가아니라연역적으로하였다.
11939,그는 진실에 대한 추구를 귀납적으로 아니라 연역적으로 하였다.,그는진실에대한추구를귀납적으로아니라연역적으로하였다.
11940,야곱이 돌을 베개로 삼았다.,야곱이돌을베개로삼았다.
11941,야곱이 베개로 돌을 삼았다.,야곱이베개로돌을삼았다.
11942,그가 학교로 뛰었다.,그가학교로뛰었다.
11943,그가 학교에 뛰었다.,그가학교에뛰었다.
11944,할머니는 한 시간 동안 파리를 쫓았다.,할머니는한시간동안파리를쫓았다.
11945,할머니는 한 시간 만에 파리를 쫓았다.,할머니는한시간만에파리를쫓았다.
11946,자신의 마음가짐이 중요하다.,자신의마음가짐이중요하다.
11947,자신은 마음가짐이 중요하다.,자신은마음가짐이중요하다.
11948,누가 이 유리를 깨뜨렸느냐?,누가이유리를깨뜨렸느냐?
11949,누구는 이 유리를 깨뜨렸느냐?,누구는이유리를깨뜨렸느냐?
11950,책이 책상 위에 있지 않다.,책이책상위에있지않다.
11951,아이들은 엄마 곁으로 보냈다.,아이들은엄마곁으로보냈다.
11952,아이들은 엄마 곁을 보냈다.,아이들은엄마곁을보냈다.
11953,축구야말로 내 특기이다.,축구야말로내특기이다.
11954,축구이야말로 내 특기이다.,축구이야말로내특기이다.
11955,"봄꽃에는 개나리, 진달래가 있군요.","봄꽃에는개나리,진달래가있군요."
11956,"봄꽃에는 개나리, 진달래가 있는군요.","봄꽃에는개나리,진달래가있는군요."
11957,그녀는 점점 말라 온다.,그녀는점점말라온다.
11958,철수는 영희가 자기를 사랑한다고 착각한다.,철수는영희가자기를사랑한다고착각한다.
11959,철수는 영희를 자기를 사랑한다고 착각한다.,철수는영희를자기를사랑한다고착각한다.
11960,지영이가 우리 가족들에게 많은 도움을 주었다.,지영이가우리가족들에게많은도움을주었다.
11961,지영이가 우리 가족들을 많은 도움을 주었다.,지영이가우리가족들을많은도움을주었다.
11962,철수는 책을 펴기와 책상 위에 엎드려버렸다.,철수는책을펴기와책상위에엎드려버렸다.
11963,영희가 학교로 출발했다.,영희가학교로출발했다.
11964,영희가 학교 출발했다.,영희가학교출발했다.
11965,지석은 아이를 혼자 버려 두었다는 죄의식에 쫓겼다.,지석은아이를혼자버려두었다는죄의식에쫓겼다.
11966,아이를 혼자 버려 두었다는 죄의식이 지석을 쫓는다.,아이를혼자버려두었다는죄의식이지석을쫓는다.
11967,우습게도 아이들이 선생님을 천재라고 오해했다.,우습게도아이들이선생님을천재라고오해했다.
11968,선생님이 아이들이 우습게도 천재라고 오해했다.,선생님이아이들이우습게도천재라고오해했다.
11969,내가 어제 방문했던 학교는 참 좋더라.,내가어제방문했던학교는참좋더라.
11970,지금 방문했던 학교는 참 좋더라.,지금방문했던학교는참좋더라.
11971,공기는 맑고 깨끗하다.,공기는맑고깨끗하다.
11972,공기는 한 시간 동안 맑고 깨끗하다.,공기는한시간동안맑고깨끗하다.
11973,이야기가 막 재미나기 시작했다.,이야기가막재미나기시작했다.
11974,내가 일부러 양말을 뒤집어 신었네.,내가일부러양말을뒤집어신었네.
11975,영주는 종종 극장에 갔다.,영주는종종극장에갔다.
11976,영주는 극장에 매우 갔다.,영주는극장에매우갔다.
11977,나는 그를 친구로 알고 있었다.,나는그를친구로알고있었다.
11978,나는 그를 친구로 모르고 있었다.,나는그를친구로모르고있었다.
11979,미국 대통령이 12월에 북한을 방문하겠다고 발표했다.,미국대통령이12월에북한을방문하겠다고발표했다.
11980,미국 대통령이 12월에 북한을 방문하겠다 하고 발표했다.,미국대통령이12월에북한을방문하겠다하고발표했다.
11981,그 풍선은 늘 조금만 건드려도 금방 터지곤 했다.,그풍선은늘조금만건드려도금방터지곤했다.
11982,그 풍선은 늘 조금만 건드렸어도 금방 터지곤 했다.,그풍선은늘조금만건드렸어도금방터지곤했다.
11983,그녀는 숙제를 빨리 할 뿐 아니라 충실히 하였다.,그녀는숙제를빨리할뿐아니라충실히하였다.
11984,그녀는 숙제를 빨리뿐 아니라 충실히 하였다.,그녀는숙제를빨리뿐아니라충실히하였다.
11985,밤이 깊어지자 영희는 스르르 눈이 감겼다.,밤이깊어지자영희는스르르눈이감겼다.
11986,밤이 깊어지자 영희는 스르르 눈을 감겼다.,밤이깊어지자영희는스르르눈을감겼다.
11987,나는 서영이를 머리가 좋다고 생각한다.,나는서영이를머리가좋다고생각한다.
11988,나는 머리를 서영이가 좋다고 생각한다.,나는머리를서영이가좋다고생각한다.
11989,오리너구리라는 동물이 있다.,오리너구리라는동물이있다.
11990,"오리너구리라는 동물이 무엇을 하냐 하면, 있다.","오리너구리라는동물이무엇을하냐하면,있다."
11991,따가운 눈총에 조리돌림을 당하였다.,따가운눈총에조리돌림을당하였다.
11992,따가운 눈총에게 조리돌림을 당하였다.,따가운눈총에게조리돌림을당하였다.
11993,같은 동포를 뜯어먹을 대로 다 뜯어 먹으면서도 호령하고 사는 것은 그놈들뿐이거든요.,같은동포를뜯어먹을대로다뜯어먹으면서도호령하고사는것은그놈들뿐이거든요.
11994,같은 동포를 뜯어서 먹을 대로 다 뜯어서 먹으면서도 호령하고 사는 것은 그놈들뿐이거든요.,같은동포를뜯어서먹을대로다뜯어서먹으면서도호령하고사는것은그놈들뿐이거든요.
11995,해숙은 몸매가 잘빠졌다.,해숙은몸매가잘빠졌다.
11996,해숙은 몸매가 잘빠진다.,해숙은몸매가잘빠진다.
11997,요즘은 누구나 대학에 간다.,요즘은누구나대학에간다.
11998,요즘은 누구가 대학에 간다.,요즘은누구가대학에간다.
11999,개는 진돗개가 영리하다.,개는진돗개가영리하다.
12000,개가 진돗개가 영리하다.,개가진돗개가영리하다.
12001,앞에 가는 군인들은 5분 동안 수통을 찼다.,앞에가는군인들은5분동안수통을찼다.
12002,앞에 가는 군인들은 5분 만에 수통을 찼다.,앞에가는군인들은5분만에수통을찼다.
12003,상황이 불리함에도 불구하고 나는 포기할 수 없었다.,상황이불리함에도불구하고나는포기할수없었다.
12004,애정을 느꼈으니까 결혼하게 되었다고 보아야지.,애정을느꼈으니까결혼하게되었다고보아야지.
12005,애정을 느끼니까 결혼하게 되었다고 보아야지.,애정을느끼니까결혼하게되었다고보아야지.
12006,형이 나에게 사과를 깎아 보인다.,형이나에게사과를깎아보인다.
12007,형이 나에게 사과를 깎아서 보인다.,형이나에게사과를깎아서보인다.
12008,불안감은 어김없이 현실로 나타나고는 한다.,불안감은어김없이현실로나타나고는한다.
12009,버스에 탔던 사람이 손을 흔들었다.,버스에탔던사람이손을흔들었다.
12010,김 선생은 자기가 직접 차를 운전한다.,김선생은자기가직접차를운전한다.
12011,자기가 김 선생은 직접 차를 운전한다.,자기가김선생은직접차를운전한다.
12012,널 기다리느라 눈이 빠지겠다.,널기다리느라눈이빠지겠다.
12013,널 기다리느라 눈이 빠졌다.,널기다리느라눈이빠졌다.
12014,철수가 재빨리 뛰어갔다.,철수가재빨리뛰어갔다.
12015,철수가 빨리 뛰어갔다.,철수가빨리뛰어갔다.
12016,자주 바쁘다.,자주바쁘다.
12017,날이 밝아 버려서 좋다.,날이밝아버려서좋다.
12018,그녀는 안 가야 한다.,그녀는안가야한다.
12019,그녀는 가야 안 한다.,그녀는가야안한다.
12020,영희가 물을 마셨어도 자기가 목이 계속 말랐다.,영희가물을마셨어도자기가목이계속말랐다.
12021,영희가 물을 마셨어도 영희가 목이 계속 말랐다.,영희가물을마셨어도영희가목이계속말랐다.
12022,그러한 환영은 그 여자의 생활 속에 깊숙이 배어 있어서 아무것도 바꿀 수 없었다.,그러한환영은그여자의생활속에깊숙이배어있어서아무것도바꿀수없었다.
12023,어머니는 아이에게 울지 말라고 달랬다.,어머니는아이에게울지말라고달랬다.
12024,어머니는 아이가 울 것을 달랬다.,어머니는아이가울것을달랬다.
12025,그는 갸름하게 빠진 흰 얼굴에 콧날이 날카로워 보였다.,그는갸름하게빠진흰얼굴에콧날이날카로워보였다.
12026,그는 갸름하게 빠지는 흰 얼굴에 콧날이 날카로워 보였다.,그는갸름하게빠지는흰얼굴에콧날이날카로워보였다.
12027,진기는 한계령 길로 설악산 대청봉에 올랐다.,진기는한계령길로설악산대청봉에올랐다.
12028,진기는 한계령 길을 설악산 대청봉에 올랐다.,진기는한계령길을설악산대청봉에올랐다.
12029,철수가 부자이다.,철수가부자이다.
12030,철수가 부자하다.,철수가부자하다.
12031,그동안 더러 혼처가 나서기는 했어도 성사는 되지 않았다.,그동안더러혼처가나서기는했어도성사는되지않았다.
12032,그동안 더러 혼처가 나서기는 해도 성사는 되지 않았다.,그동안더러혼처가나서기는해도성사는되지않았다.
12033,내가 너를 마구 때려 주마.,내가너를마구때려주마.
12034,내가 너를 마구 때려 주더라.,내가너를마구때려주더라.
12035,직장인들이 출근할 때 자전거는 이용한다.,직장인들이출근할때자전거는이용한다.
12036,직장인들이 출근할 때 이용하는 것은 자전거는이다.,직장인들이출근할때이용하는것은자전거는이다.
12037,"철수는 연필을 책상에 두었고, 영희도 그리했다.","철수는연필을책상에두었고,영희도그리했다."
12038,"철수는 연필을 책상에 두었고, 영희도 연필을 책상에 그리했다.","철수는연필을책상에두었고,영희도연필을책상에그리했다."
12039,철수가 착한 학생이다.,철수가착한학생이다.
12040,철수가 착하게 학생이다.,철수가착하게학생이다.
12041,독자들이 눈도장 찍기 행태에 머물렀다.,독자들이눈도장찍기행태에머물렀다.
12042,눈도장을 찍기 행태에 머물렀다.,눈도장을찍기행태에머물렀다.
12043,바람에 나뭇잎이 나부끼고 있다.,바람에나뭇잎이나부끼고있다.
12044,바람에 나뭇잎이 나부끼는 중이다.,바람에나뭇잎이나부끼는중이다.
12045,그가 죄를 덮어썼다.,그가죄를덮어썼다.
12046,그가 죄를 덮어서 썼다.,그가죄를덮어서썼다.
12047,지수는 친구 소개로 잠깐 마주쳤던 정인을 미인으로 생각한다.,지수는친구소개로잠깐마주쳤던정인을미인으로생각한다.
12048,지수는 미인으로 친구 소개로 잠깐 마주쳤던 정인을 생각한다.,지수는미인으로친구소개로잠깐마주쳤던정인을생각한다.
12049,철수는 도서관 앞에 있다.,철수는도서관앞에있다.
12050,철수는 도서관 앞에 있으려고 노력한다.,철수는도서관앞에있으려고노력한다.
12051,포수가 다가오자 위험을 느낀 새가 높이 날았다.,포수가다가오자위험을느낀새가높이날았다.
12052,포수가 다가오자 위험을 느낀 새가 높이 갔다.,포수가다가오자위험을느낀새가높이갔다.
12053,이 지갑에 돈이 있다.,이지갑에돈이있다.
12054,이 지갑이 돈이 있다.,이지갑이돈이있다.
12055,그들은 차를 마시고 일을 했다.,그들은차를마시고일을했다.
12056,"그들은 일을, 차를 마시고, 했다.","그들은일을,차를마시고,했다."
12057,어떻게 할지 생각해 봤어?,어떻게할지생각해봤어?
12058,어떡할지 생각해 봤어?,어떡할지생각해봤어?
12059,누가 하느님을 보았다 하는가?,누가하느님을보았다하는가?
12060,"맞선 본 여자가 예뻤어 봐, 당장 결혼하쟀지.","맞선본여자가예뻤어봐,당장결혼하쟀지."
12061,"맞선 본 여자가 예뻤어 보면, 당장 결혼하쟀지.","맞선본여자가예뻤어보면,당장결혼하쟀지."
12062,그는 하던 말을 멈추고 잠시 생각에 잠겼다.,그는하던말을멈추고잠시생각에잠겼다.
12063,그는 했던 말을 멈추고 잠시 생각에 잠겼다.,그는했던말을멈추고잠시생각에잠겼다.
