,correct_sentence,wrong_sentence
8121,강도가 육중한 물체로 무엇인가 피해자를 내리쳤다.,강도가육중한물체로무엇인가피해자를내리쳤다.
8122,미나가 어제 산 것들은 가방이었다.,미나가어제산것들은가방이었다.
8123,철수는 그 문제의 해법을 정확히 알고 있다.,철수는그문제의해법을정확히알고있다.
8124,철수는 그 문제의 해법을 알고 정확히 있다.,철수는그문제의해법을알고정확히있다.
8125,그가 학교에 가거나 철수가 도서관에 간다.,그가학교에가거나철수가도서관에간다.
8126,철수가 학교에 가거나 철수가 도서관에 간다.,철수가학교에가거나철수가도서관에간다.
8127,어제 숙제를 하느라고 잠을 못 잤다.,어제숙제를하느라고잠을못잤다.
8128,어제 숙제를 했느라고 잠을 못 잤다.,어제숙제를했느라고잠을못잤다.
8129,영희가 철수에게 전화를 합디까?,영희가철수에게전화를합디까?
8130,네가 철수에게 전화를 합디까?,네가철수에게전화를합디까?
8131,"나는 공부를 하고 있어서 잘 모르지만, 철수는 지금 공을 차고 있을 거야.","나는공부를하고있어서잘모르지만,철수는지금공을차고있을거야."
8132,"나는 공부를 하고 있어서 잘 모르지만, 철수는 지금 공을 차고 있네.","나는공부를하고있어서잘모르지만,철수는지금공을차고있네."
8133,사과는 대구에서 나는 것이 맛있다.,사과는대구에서나는것이맛있다.
8134,사과는 대구에서 정말 나는 것이 맛있다.,사과는대구에서정말나는것이맛있다.
8135,오늘 저녁은 제가 사겠어요.,오늘저녁은제가사겠어요.
8136,오늘 저녁은 제가 살 거예요.,오늘저녁은제가살거예요.
8137,나는 철수가 가는 주면 좋겠다.,나는철수가가는주면좋겠다.
8138,나는 곧바로 집으로 들어가기가 싫다.,나는곧바로집으로들어가기가싫다.
8139,너는 곧바로 집으로 들어가기가 싫다.,너는곧바로집으로들어가기가싫다.
8140,"네가 학교에 가더니, 바로 집으로 돌아왔느냐?","네가학교에가더니,바로집으로돌아왔느냐?"
8141,감개무량합니다.,감개무량합니다.
8142,감개무량입니다.,감개무량입니다.
8143,오늘 아침에 뭐 하고 있었어요?,오늘아침에뭐하고있었어요?
8144,오늘 아침에 뭐 하고 있어요?,오늘아침에뭐하고있어요?
8145,너는 사과가 그렇게까지 좋니?,너는사과가그렇게까지좋니?
8146,너는 사과가 너무까지 좋니?,너는사과가너무까지좋니?
8147,이게 우리가 좋아하는 음식이야.,이게우리가좋아하는음식이야.
8148,이게 우리 좋아하는 음식이야.,이게우리좋아하는음식이야.
8149,"철수도 왔고요, 영희도 왔어요.","철수도왔고요,영희도왔어요."
8150,"철수도 왔으며요, 영희도 왔어요.","철수도왔으며요,영희도왔어요."
8151,비가 오네.,비가오네.
8152,비가 와라.,비가와라.
8153,철수가 강도에게 영희의 가방을 찢겼다.,철수가강도에게영희의가방을찢겼다.
8154,어떤 인간이 그 따위 얘기를 해?,어떤인간이그따위얘기를해?
8155,어떤 인간 그 따위 얘기를 해?,어떤인간그따위얘기를해?
8156,아들 내외가 친척들에게 인사했다.,아들내외가친척들에게인사했다.
8157,아들 내외가 친척들에게의 인사를 다녔다.,아들내외가친척들에게의인사를다녔다.
8158,내가 영희가 싫었던 것은 그녀의 낭비벽 때문이었다.,내가영희가싫었던것은그녀의낭비벽때문이었다.
8159,나는 영희가 싫었던 것은 그녀의 낭비벽 때문이었다.,나는영희가싫었던것은그녀의낭비벽때문이었다.
8160,산삼이구나.,산삼이구나.
8161,산삼이어라.,산삼이어라.
8162,시집 일찍 간다고 잘 사는 거 아니니?,시집일찍간다고잘사는거아니니?
8163,철수가 걔가 영희를 좋아하니?,철수가걔가영희를좋아하니?
8164,앉고 보니 조금 전에 남자가 있었던 바로 그 자리였다.,앉고보니조금전에남자가있었던바로그자리였다.
8165,할아버지가 책을 사러 서점에 갔다.,할아버지가책을사러서점에갔다.
8166,할아버지가 자기가 책을 사시러 서점에 갔다.,할아버지가자기가책을사시러서점에갔다.
8167,철수가 담벼락을 찼다.,철수가담벼락을찼다.
8168,철수가 담벼락을 안쪽으로 찼다.,철수가담벼락을안쪽으로찼다.
8169,저 소나무 밑에 누가 있지 뭡니까?,저소나무밑에누가있지뭡니까?
8170,범인이 반장에게 체포가 되었다.,범인이반장에게체포가되었다.
8171,범인이 반장 체포가 되었다.,범인이반장체포가되었다.
8172,책상에 방석을 얹었다.,책상에방석을얹었다.
8173,책상을 방석으로 얹었다.,책상을방석으로얹었다.
8174,나는 좋은 물건 쪽으로 자꾸 눈이 가더라.,나는좋은물건쪽으로자꾸눈이가더라.
8175,너는 좋은 물건 쪽으로 자꾸 눈이 가더라.,너는좋은물건쪽으로자꾸눈이가더라.
8176,철수는 키가 커서 지금 160cm만큼 되었어.,철수는키가커서지금160cm만큼되었어.
8177,철수는 키가 커서 지금 160cm만 되었어.,철수는키가커서지금160cm만되었어.
8178,우리의 행복은 앞 세대의 희생 덕분이다.,우리의행복은앞세대의희생덕분이다.
8179,우리의 행복은 뒤 세대의 희생 덕분이다.,우리의행복은뒤세대의희생덕분이다.
8180,박혁거세는 알에서 나왔다더라.,박혁거세는알에서나왔다더라.
8181,박혁거세는 알을 나왔다더라.,박혁거세는알을나왔다더라.
8182,비 오는데 빨리 우산 쓰자.,비오는데빨리우산쓰자.
8183,비 오더니 빨리 우산 써라.,비오더니빨리우산써라.
8184,"아무 말 말고 눈을 감아 보란 말이야, 감아 보라고.","아무말말고눈을감아보란말이야,감아보라고."
8185,"아무 말 말고 눈을 감아 보란 말이야, 보라고.","아무말말고눈을감아보란말이야,보라고."
8186,나 이 옷 입으면 예쁠 거니?,나이옷입으면예쁠거니?
8187,"선생님, 할아버지 설명이 이해가 가십니까?","선생님,할아버지설명이이해가가십니까?"
8188,"선생님, 할아버지 설명이 이해가 갑니까?","선생님,할아버지설명이이해가갑니까?"
8189,쉿! 모두들 조용히 해요.,쉿!모두들조용히해요.
8190,쉿요! 모두들 조용히 해요.,쉿요!모두들조용히해요.
8191,매듭이 철수에 의해 풀렸다.,매듭이철수에의해풀렸다.
8192,매듭이 철수에게 풀렸다.,매듭이철수에게풀렸다.
8193,영수가 책을 읽는 것은 의자에 앉아서이다.,영수가책을읽는것은의자에앉아서이다.
8194,영수가 책을 읽는 것은 의자에 앉아이다.,영수가책을읽는것은의자에앉아이다.
8195,인호는 미나에게 오랫동안 TV를 보고 말했다.,인호는미나에게오랫동안TV를보고말했다.
8196,인호는 미나에게 오랫동안 TV를 보았고 말했다.,인호는미나에게오랫동안TV를보았고말했다.
8197,비가 와서 옷이 젖었다.,비가와서옷이젖었다.
8198,비가 왔어 옷이 젖었다.,비가왔어옷이젖었다.
8199,원래 그렇게 말 많은 녀석치고 뭐 하나 제대로 하는 놈 없다니까.,원래그렇게말많은녀석치고뭐하나제대로하는놈없다니까.
8200,녀석치고 뭐 하나 제대로 하는 놈 없다니까.,녀석치고뭐하나제대로하는놈없다니까.
8201,영수는 나를 알면서 모르는 척했다.,영수는나를알면서모르는척했다.
8202,영수는 나를 알며 모르는 척했다.,영수는나를알며모르는척했다.
8203,인호가 만난 사람들은 의사였다.,인호가만난사람들은의사였다.
8204,인호가 만난 것들은 의사였다.,인호가만난것들은의사였다.
8205,김 선생님이 학생들이 착해요.,김선생님이학생들이착해요.
8206,김 선생님이 학생들이 착하셔요.,김선생님이학생들이착하셔요.
8207,1시에 뭐 해요?,1시에뭐해요?
8208,1시 뭐 해요?,1시뭐해요?
8209,어떤 사람이 책을 샀다.,어떤사람이책을샀다.
8210,어떤 사람 책을 샀다.,어떤사람책을샀다.
8211,아이들로 교실이 가득하다.,아이들로교실이가득하다.
8212,아이들로 교실이 가득하지 않다.,아이들로교실이가득하지않다.
8213,네가 뭐 돈을 잘 벌기를 하냐 뭐 집안일을 잘 하기를 하냐?,네가뭐돈을잘벌기를하냐뭐집안일을잘하기를하냐?
8214,네가 뭐 돈을 잘 벌기는 하냐 뭐 집안일을 잘 하기를 하냐?,네가뭐돈을잘벌기는하냐뭐집안일을잘하기를하냐?
8215,이웃집에서 고기 굽는 것이 구수하구나.,이웃집에서고기굽는것이구수하구나.
8216,이웃집에서 고기 구움이 구수하구나.,이웃집에서고기구움이구수하구나.
8217,민수가 수희를 싸웠다.,민수가수희를싸웠다.
8218,강력한 세력이 대두될 것이다.,강력한세력이대두될것이다.
8219,누구도 나무를 보았어요?,누구도나무를보았어요?
8220,그렇게 다그쳐서는 여간해서 대답하지 않을 거야.,그렇게다그쳐서는여간해서대답하지않을거야.
8221,그렇게 다그쳐서는 여간해서 대답할 거야.,그렇게다그쳐서는여간해서대답할거야.
8222,남을 헐뜯는 사람 치고 똑똑한 사람은 없다.,남을헐뜯는사람치고똑똑한사람은없다.
8223,사람 치고 똑똑한 사람은 없다.,사람치고똑똑한사람은없다.
8224,딸과 대화 좀 하세요.,딸과대화좀하세요.
8225,딸이 대화 좀 하세요.,딸이대화좀하세요.
8226,책을 100권만큼을 많이 샀어.,책을100권만큼을많이샀어.
8227,책을 많이 백 권만큼을 샀어.,책을많이백권만큼을샀어.
8228,위성사진을 분석한 결과 핵시설 위치를 확인하게 되었다.,위성사진을분석한결과핵시설위치를확인하게되었다.
8229,위성사진을 분석한 결과가 핵시설 위치를 확인하게 되었다.,위성사진을분석한결과가핵시설위치를확인하게되었다.
8230,내일 철수가 오겠고 어제 영희가 왔다.,내일철수가오겠고어제영희가왔다.
8231,내일 철수가 오겠거나 어제 영희가 왔다.,내일철수가오겠거나어제영희가왔다.
8232,그는 장가를 가고서 사람이 완전히 달라졌다.,그는장가를가고서사람이완전히달라졌다.
8233,그는 장가를 가면 사람이 완전히 달라졌다.,그는장가를가면사람이완전히달라졌다.
8234,그는 1939년에서 1940년 사이에 정치적 탄압을 피해 미국으로 망명했다.,그는1939년에서1940년사이에정치적탄압을피해미국으로망명했다.
8235,그는 1939년에서 1940년 동안에 정치적 탄압을 피해 미국으로 망명했다.,그는1939년에서1940년동안에정치적탄압을피해미국으로망명했다.
8236,너는 학교에 가겠더라.,너는학교에가겠더라.
8237,나는 학교에 가겠더라.,나는학교에가겠더라.
8238,감은 영양 가치가 매우 높은 과일 중의 하나로 주성분은 탄수화물이다.,감은영양가치가매우높은과일중의하나로주성분은탄수화물이다.
8239,영양 가치가 매우 높은 과일 중의 하나로 감은 주성분은 탄수화물이다.,영양가치가매우높은과일중의하나로감은주성분은탄수화물이다.
8240,철수가 사장에게 현장을 보고 안 한다.,철수가사장에게현장을보고안한다.
8241,철수가 사장에게 현장을 안 보고한다.,철수가사장에게현장을안보고한다.
8242,그의 글은 짧고 간결했으되 천 마디의 함축이 있었다.,그의글은짧고간결했으되천마디의함축이있었다.
8243,"말이 그렇지, 그런 사람이 어디 그리 쉬운가?","말이그렇지,그런사람이어디그리쉬운가?"
8244,"말이 그치, 그런 사람이 어디 그리 쉬운가?","말이그치,그런사람이어디그리쉬운가?"
8245,조금밖에 안 먹었는데 벌써 배가 부르다.,조금밖에안먹었는데벌써배가부르다.
8246,잘밖에 안 먹었는데 벌써 배가 부르다.,잘밖에안먹었는데벌써배가부르다.
8247,영희를 세 사람이 칭찬했어.,영희를세사람이칭찬했어.
8248,영희를 세 사람 칭찬했어.,영희를세사람칭찬했어.
8249,우리는 정답이 무엇인가를 알아보았다.,우리는정답이무엇인가를알아보았다.
8250,우리는 정답이 무엇을 알아보았다.,우리는정답이무엇을알아보았다.
8251,어제 철수가 가거나 지금 영희가 간다.,어제철수가가거나지금영희가간다.
8252,어제 철수가 가지만 지금 영희가 간다.,어제철수가가지만지금영희가간다.
8253,우리가 오늘도 회사에 지각할 것이 걱정이다.,우리가오늘도회사에지각할것이걱정이다.
8254,우리가 오늘도 회사에 지각함이 걱정이다.,우리가오늘도회사에지각함이걱정이다.
8255,영희는 가끔씩 영화를 보았다.,영희는가끔씩영화를보았다.
8256,영희는 종종씩 영화를 보았다.,영희는종종씩영화를보았다.
8257,지금 밥 먹겠달까?,지금밥먹겠달까?
8258,지금 밥 먹는다겠을까?,지금밥먹는다겠을까?
8259,이 꽃은 안 예쁘군요.,이꽃은안예쁘군요.
8260,이 꽃은 안 예뻐라.,이꽃은안예뻐라.
8261,피카소의 그림이 아름답다.,피카소의그림이아름답다.
8262,피카소의 그림이 예쁘다.,피카소의그림이예쁘다.
8263,철수가 다시 돌아왔으니까 철수는 영희를 사랑하는가 보다.,철수가다시돌아왔으니까철수는영희를사랑하는가보다.
8264,600번 버스가 우리 집 앞에 다닌다.,600번버스가우리집앞에다닌다.
8265,600번 버스가 우리 집 앞에 다녀갔다.,600번버스가우리집앞에다녀갔다.
8266,그는 고생 안 하고서 큰돈을 벌었다.,그는고생안하고서큰돈을벌었다.
8267,그는 고생 안 해서 큰돈을 벌었다.,그는고생안해서큰돈을벌었다.
8268,나는 철수네 집에 갔습디다.,나는철수네집에갔습디다.
8269,나는 철수네 집에 갑디다.,나는철수네집에갑디다.
8270,"나는 창조론의 논문을 읽었고, 그는 진화론의 논문을 읽었다.","나는창조론의논문을읽었고,그는진화론의논문을읽었다."
8271,민호가 칼에 찔렸다.,민호가칼에찔렸다.
8272,칼이 민호를 찔렀다.,칼이민호를찔렀다.
8273,회장실에서 회장님이 명령을 내리셨습니다.,회장실에서회장님이명령을내리셨습니다.
8274,회장실이 회장님이 명령을 내리셨습니다.,회장실이회장님이명령을내리셨습니다.
8275,산이는 단우가 연우를 때리는 장면을 확신하고 있다.,산이는단우가연우를때리는장면을확신하고있다.
8276,그는 나와 친구이다.,그는나와친구이다.
8277,나는 심심하다.,나는심심하다.
8278,나는 철수가 심심하다.,나는철수가심심하다.
8279,그 사람 괜찮던데 두 번 만나 봐.,그사람괜찮던데두번만나봐.
8280,우리 법우들에게 부끄럽지 않은 선생으로 남고 싶다.,우리법우들에게부끄럽지않은선생으로남고싶다.
8281,우리 법우들에게 부끄럽지 않은 선생을 남고 싶다.,우리법우들에게부끄럽지않은선생을남고싶다.
8282,엄마를 만나서는 비로소 병원으로 향했다.,엄마를만나서는비로소병원으로향했다.
8283,엄마를 만나는 비로소 병원으로 향했다.,엄마를만나는비로소병원으로향했다.
8284,"뒤에서 언급하겠지만, 우리는 이겨야 한다.","뒤에서언급하겠지만,우리는이겨야한다."
8285,"이하에서 언급하겠지만, 우리는 이겨야 한다.","이하에서언급하겠지만,우리는이겨야한다."
8286,학교에 올 때 문구점에 들렀어요.,학교에올때문구점에들렀어요.
8287,학교에 왔을 때 문구점에 들렀어요.,학교에왔을때문구점에들렀어요.
8288,철수는 선생님들을 학교에 세 분이 남는다고 생각했다.,철수는선생님들을학교에세분이남는다고생각했다.
8289,선생님들이 학교에 세 분이 남기를 원하셨다.,선생님들이학교에세분이남기를원하셨다.
8290,무엇인가 육중한 물체가 떨어졌다.,무엇인가육중한물체가떨어졌다.
8291,그게 무엇인가 육중한 물체가 떨어졌다.,그게무엇인가육중한물체가떨어졌다.
8292,시험장에 일 분이라도 늦어서는 들어갈 수 없을 것이다.,시험장에일분이라도늦어서는들어갈수없을것이다.
8293,시험장에 일 분이라도 늦어서 들어갈 수 없을 것이다.,시험장에일분이라도늦어서들어갈수없을것이다.
8294,양말이 싸서 동생이 한 켤레 더 샀다.,양말이싸서동생이한켤레더샀다.
8295,양말이 싸기에 동생이 한 켤레 더 샀다.,양말이싸기에동생이한켤레더샀다.
8296,술을 마시니까 머리가 아팠어요.,술을마시니까머리가아팠어요.
8297,그들이 이미 밥을 다 먹어 버린다.,그들이이미밥을다먹어버린다.
8298,이건 해도 해도 너무하는 거 아냐.,이건해도해도너무하는거아냐.
8299,이건 해도 해도 너무하는 건 아냐.,이건해도해도너무하는건아냐.
8300,비가 올지도 모르겠으니 꼭 우산을 챙기세요.,비가올지도모르겠으니꼭우산을챙기세요.
8301,비가 안 올 것 같으니 꼭 우산을 챙기세요.,비가안올것같으니꼭우산을챙기세요.
8302,나는 영희가 머릿결이 좋다고 생각한다.,나는영희가머릿결이좋다고생각한다.
8303,나는 머릿결을 영희가 좋다고 생각한다.,나는머릿결을영희가좋다고생각한다.
8304,음식 맛을 보고 장조림이 맛있어서 애들이 밥을 다 먹었겠구나.,음식맛을보고장조림이맛있어서애들이밥을다먹었겠구나.
8305,음식 맛을 보고 장조림이 맛있어서 애들이 밥을 다 먹었구나.,음식맛을보고장조림이맛있어서애들이밥을다먹었구나.
8306,"밥을 이미 다 먹었으니, 이제 슬슬 출발해 볼까?","밥을이미다먹었으니,이제슬슬출발해볼까?"
8307,"밥을 이미 다 먹으니, 이제 슬슬 출발해 볼까?","밥을이미다먹으니,이제슬슬출발해볼까?"
8308,어제 비가 왔음 직하다,어제비가왔음직하다
8309,어제 비가 왔음의 직하다.,어제비가왔음의직하다.
8310,미리 얘길 해 줘야 될 게 아냐.,미리얘길해줘야될게아냐.
8311,미리 얘길 해 줘야 될 건 아냐.,미리얘길해줘야될건아냐.
8312,"나는 그 영화가 처음에는 재미없더니, 보면 볼수록 재미있었다.","나는그영화가처음에는재미없더니,보면볼수록재미있었다."
8313,돌발 상황이 인호를 오히려 침착하도록 했다.,돌발상황이인호를오히려침착하도록했다.
8314,돌발 상황이 인호가 오히려 침착하도록 했다.,돌발상황이인호가오히려침착하도록했다.
8315,나는 선생님의 말씀이 이해가 되었다.,나는선생님의말씀이이해가되었다.
8316,나는 선생님의 말씀이 쉬운 이해가 되었다.,나는선생님의말씀이쉬운이해가되었다.
8317,영희는 아주 많이 먹었다.,영희는아주많이먹었다.
8318,영희는 아주 먹었다.,영희는아주먹었다.
8319,철수가 안 먹은 것은 모든 음식이다.,철수가안먹은것은모든음식이다.
8320,접근 방식이 소개팅 그런 게 아니던 게 얘한텐 되게 좋았나 봐요.,접근방식이소개팅그런게아니던게얘한텐되게좋았나봐요.
8321,철수가 그 책을 나에게 주었다.,철수가그책을나에게주었다.
8322,철수가 그 책을 나를 건넸다.,철수가그책을나를건넸다.
8323,"나는 그에게 집에 가자는 부탁, 요청을 했다.","나는그에게집에가자는부탁,요청을했다."
8324,나는 그에게 집에 가는 부탁을 했다.,나는그에게집에가는부탁을했다.
8325,"진수아, 내일 좀 와.","진수아,내일좀와."
8326,"지수야, 내일 좀 오십시오.","지수야,내일좀오십시오."
8327,나는 오 분 동안 책상 위에 책을 놓았다.,나는오분동안책상위에책을놓았다.
8328,철수가 영미를 만나지를 않았다.,철수가영미를만나지를않았다.
8329,철수가 영미를 만나지가 않았다.,철수가영미를만나지가않았다.
8330,조그만 아이가 밥을 세 그릇만큼 먹었다.,조그만아이가밥을세그릇만큼먹었다.
8331,조그만 아이가 밥을 먹은 것은 세 그릇만큼이다.,조그만아이가밥을먹은것은세그릇만큼이다.
8332,아버님이 키가 크세요.,아버님이키가크세요.
8333,철수가 방에서 운동하고 있다.,철수가방에서운동하고있다.
8334,철수가 방에 운동하고 있다.,철수가방에운동하고있다.
8335,학생들이 빵을 10개만큼을 많이 먹었다.,학생들이빵을10개만큼을많이먹었다.
8336,학생들이 빵을 많이 10개만큼을 먹었다.,학생들이빵을많이10개만큼을먹었다.
8337,인호가 만난 사람과 진호가 만난 사람은 학생이다.,인호가만난사람과진호가만난사람은학생이다.
8338,인호가 만난 것과 진호가 만난 것은 학생이다.,인호가만난것과진호가만난것은학생이다.
8339,그 사람 맨날 아파 놔서 큰일이야.,그사람맨날아파놔서큰일이야.
8340,그 떡은 먹음직했다.,그떡은먹음직했다.
8341,그 떡은 먹었음직 했다.,그떡은먹었음직했다.
8342,"그가 학교에 가더니, 집으로 돌아왔다.","그가학교에가더니,집으로돌아왔다."
8343,"내가 학교에 가더니, 집으로 돌아왔다.","내가학교에가더니,집으로돌아왔다."
8344,철수는 검문을 피해 옆길로 돌아갔다.,철수는검문을피해옆길로돌아갔다.
8345,철수는 검문을 피해 옆길을 돌아갔다.,철수는검문을피해옆길을돌아갔다.
8346,운동 전에 밥을 먹어 두어라.,운동전에밥을먹어두어라.
8347,운동 전에 밥을 먹어서 두어라.,운동전에밥을먹어서두어라.
8348,그가 철수를 대통령으로 만들었다.,그가철수를대통령으로만들었다.
8349,그가 그녀를 주목하는 것은 두 가지 이유이다.,그가그녀를주목하는것은두가지이유이다.
8350,그가 그녀를 주목하는 것은 두 가지 이유에서이다.,그가그녀를주목하는것은두가지이유에서이다.
8351,나는 철수의 의견에 찬성한다.,나는철수의의견에찬성한다.
8352,나는 철수의 의견 찬성한다.,나는철수의의견찬성한다.
8353,작업이 시작됐다.,작업이시작됐다.
8354,작업이 시작했다.,작업이시작했다.
8355,철수는 책상 위에 책을 놓는 중이다.,철수는책상위에책을놓는중이다.
8356,철수는 책상 위에 책을 두는 중이다.,철수는책상위에책을두는중이다.
8357,그 사람이 애써 만든 작품을 다 부숴 놓았다.,그사람이애써만든작품을다부숴놓았다.
8358,그 사람이 애써 만든 작품을 다 부숴 뒀다.,그사람이애써만든작품을다부숴뒀다.
8359,순희가 철수에게 영희에게 무릎을 꿇게 하였다.,순희가철수에게영희에게무릎을꿇게하였다.
8360,순희가 철수에게 영희에게 무릎을 꿇리었다.,순희가철수에게영희에게무릎을꿇리었다.
8361,김 선생님은 교장이 되자마자 많은 교칙을 만들었습니다.,김선생님은교장이되자마자많은교칙을만들었습니다.
8362,김 선생님은 교장이 되기가 무섭게 많은 교칙을 만들었습니다.,김선생님은교장이되기가무섭게많은교칙을만들었습니다.
8363,나는 철수가 싫다.,나는철수가싫다.
8364,나한테는 철수가 싫다.,나한테는철수가싫다.
8365,나는 일부러 꿈을 가지고 있다.,나는일부러꿈을가지고있다.
8366,나에게는 일부러 꿈이 있다.,나에게는일부러꿈이있다.
8367,오랜 고생을 한 끝에 좋은 결과를 얻게 되었다.,오랜고생을한끝에좋은결과를얻게되었다.
8368,오랜 고생을 한 끝에는 좋은 결과를 얻게 되었다.,오랜고생을한끝에는좋은결과를얻게되었다.
8369,사회와 문화가 급속히 발달해 가자 평등하였던 씨족 사회 내부에 빈부의 격차가 생기기 시작하였다.,사회와문화가급속히발달해가자평등하였던씨족사회내부에빈부의격차가생기기시작하였다.
8370,사회와 문화가 급속히 발달해 갔자 평등하였던 씨족 사회 내부에 빈부의 격차가 생기기 시작하였다.,사회와문화가급속히발달해갔자평등하였던씨족사회내부에빈부의격차가생기기시작하였다.
8371,따님은 언제 돌아가는지요?,따님은언제돌아가는지요?
8372,따님은 언제 돌아갈는지요?,따님은언제돌아갈는지요?
8373,그 기차가 역에 계속 도착하고 있다.,그기차가역에계속도착하고있다.
8374,운전자가 가는 길의 방향을 꺾었다.,운전자가가는길의방향을꺾었다.
8375,가는 길의 방향이 운전자에 의해 꺾였다.,가는길의방향이운전자에의해꺾였다.
8376,나는 영화를 만들고 싶다.,나는영화를만들고싶다.
