,correct_sentence,wrong_sentence
4181,촘스키도 변형문법을 완전히 이해한다.,촘스키도변형문법을완전히이해한다.
4182,내 생일은 10월 3일입니다.,내생일은10월3일입니다.
4183,우리 생일은 10월 3일입니다.,우리생일은10월3일입니다.
4184,배추가 상인들에 의해서 주부들한테 팔렸다.,배추가상인들에의해서주부들한테팔렸다.
4185,배추가 상인들한테 주부들한테 팔렸다.,배추가상인들한테주부들한테팔렸다.
4186,사과 나는 세 개를 먹었다.,사과나는세개를먹었다.
4187,경미는 엷은 한숨을 자기도 모르게 길게 내뿜었다.,경미는엷은한숨을자기도모르게길게내뿜었다.
4188,뒤꼍에 밭이 있다.,뒤꼍에밭이있다.
4189,뒤꼍이 밭이 있다.,뒤꼍이밭이있다.
4190,책상 위에 그 책 있어.,책상위에그책있어.
4191,하나님의 나라는 말에 있지 않고 능력에 있습니다.,하나님의나라는말에있지않고능력에있습니다.
4192,하나님의 나라는 말에 없고 능력에 있습니다.,하나님의나라는말에없고능력에있습니다.
4193,눈만 멀뚱멀뚱 뜨고 있다.,눈만멀뚱멀뚱뜨고있다.
4194,눈만을 멀뚱멀뚱 뜨고 있다.,눈만을멀뚱멀뚱뜨고있다.
4195,지금 밖에 누가 찾아왔다.,지금밖에누가찾아왔다.
4196,지금 밖에 누구 찾아왔다.,지금밖에누구찾아왔다.
4197,철수가 영희를 껴안자 사람들이 웅성거리기 시작했다.,철수가영희를껴안자사람들이웅성거리기시작했다.
4198,철수가 영희는 껴안자 사람들이 웅성거리기 시작했다.,철수가영희는껴안자사람들이웅성거리기시작했다.
4199,김 씨는 자식을 자기가 원하는 곳에 살렸다.,김씨는자식을자기가원하는곳에살렸다.
4200,진이가 근이를 창밖으로 밀었다.,진이가근이를창밖으로밀었다.
4201,영희는 아마 갔을 것이다.,영희는아마갔을것이다.
4202,영희는 아마 갔다.,영희는아마갔다.
4203,앞서거니 뒤서거니 하셨다.,앞서거니뒤서거니하셨다.
4204,앞서시거니 뒤서시거니 하셨다.,앞서시거니뒤서시거니하셨다.
4205,술 좀 그만 드세요.,술좀그만드세요.
4206,술 좀 그만 드시지 마세요.,술좀그만드시지마세요.
4207,너는 울음을 꺽꺽 삼키는 시늉이다.,너는울음을꺽꺽삼키는시늉이다.
4208,나는 울음을 꺽꺽 삼키는 시늉이다.,나는울음을꺽꺽삼키는시늉이다.
4209,다 잔 거니?,다잔거니?
4210,모두 잔 거니?,모두잔거니?
4211,새가 꽃이 피고 운다.,새가꽃이피고운다.
4212,세월은 흐르는 물과 같다.,세월은흐르는물과같다.
4213,세월은 흐르는 물하고 같다.,세월은흐르는물하고같다.
4214,나는 어제 거기 갔어.,나는어제거기갔어.
4215,나는 어제 거기 왔어.,나는어제거기왔어.
4216,평일 같으면 드나드는 사람들로 한창 북적댈 시간이었다.,평일같으면드나드는사람들로한창북적댈시간이었다.
4217,그날들이 같으면 사람들로 한창 북적댈 시간이었다.,그날들이같으면사람들로한창북적댈시간이었다.
4218,그 학회가 철수의 논문을 올해의 우수 논문으로 선정했다.,그학회가철수의논문을올해의우수논문으로선정했다.
4219,그 학회가 철수의 논문을 선정했다.,그학회가철수의논문을선정했다.
4220,낡은 건물은 당국에 의해 부서지게 마련이다.,낡은건물은당국에의해부서지게마련이다.
4221,낡은 건물은 당국에 부수어지게 마련이다.,낡은건물은당국에부수어지게마련이다.
4222,우리는 날마다 운동장에 모였다.,우리는날마다운동장에모였다.
4223,우리는 날에마다 운동장에 모였다.,우리는날에마다운동장에모였다.
4224,차마 그녀의 얼굴을 볼 수 없었다.,차마그녀의얼굴을볼수없었다.
4225,할아버지께서는 그늘에 있는 강낭콩은 잘 자라지 않겠다고 가르쳐 주셨다.,할아버지께서는그늘에있는강낭콩은잘자라지않겠다고가르쳐주셨다.
4226,영수가 그 애를 꽃을 주었어요.,영수가그애를꽃을주었어요.
4227,영수가 그 애에게로 꽃을 주었어요.,영수가그애에게로꽃을주었어요.
4228,희랍인에게는 지구가 평평하였다.,희랍인에게는지구가평평하였다.
4229,희랍인이 지구가 편편하였다.,희랍인이지구가편편하였다.
4230,철수만 오면 우리가 이길 수 있어.,철수만오면우리가이길수있어.
4231,철수만이 오면 우리가 이길 수 있어.,철수만이오면우리가이길수있어.
4232,저 사람이 우리 남편입니다.,저사람이우리남편입니다.
4233,저 사람이 우리의 남편입니다.,저사람이우리의남편입니다.
4234,당신은 돈이 많이 있으세요?,당신은돈이많이있으세요?
4235,당신은 돈이 많이 계세요?,당신은돈이많이계세요?
4236,아이들을 따뜻하게 보살핌이 영이의 일이다.,아이들을따뜻하게보살핌이영이의일이다.
4237,송탄은 다시 평택에 속한다.,송탄은다시평택에속한다.
4238,송탄은 또 평택에 속한다.,송탄은또평택에속한다.
4239,인수가 순이에게 잡혔다.,인수가순이에게잡혔다.
4240,인수가 순이를 잡혔다.,인수가순이를잡혔다.
4241,철수는 가짜 그림을 진짜라고 여기고 속아서 비싸게 샀다.,철수는가짜그림을진짜라고여기고속아서비싸게샀다.
4242,철수는 가짜그림을 진짜라고 치고 속아서 비싸게 샀다.,철수는가짜그림을진짜라고치고속아서비싸게샀다.
4243,"철수가 논문을 마쳐야, 집에 갈 수 있다.","철수가논문을마쳐야,집에갈수있다."
4244,"논문을 마쳐야, 철수가 집에 갈 수 있다.","논문을마쳐야,철수가집에갈수있다."
4245,영희가 학교에를 갔다.,영희가학교에를갔다.
4246,영희가 학교에로 갔다.,영희가학교에로갔다.
4247,철수가 학교에 가거나 철수가 도서관에 가거나 한다.,철수가학교에가거나철수가도서관에가거나한다.
4248,자기가 학교에 가거나 철수가 도서관에 가거나 한다.,자기가학교에가거나철수가도서관에가거나한다.
4249,영희는 그 집에 가지 않았다. 이것은 확실하다.,영희는그집에가지않았다.이것은확실하다.
4250,영희는 그 집에 갔다. 그러나 확실히 가지 않았다.,영희는그집에갔다.그러나확실히가지않았다.
4251,진이가 구석으로 몰렸다.,진이가구석으로몰렸다.
4252,진이가 구석을 몰렸다.,진이가구석을몰렸다.
4253,철수는 저녁을 나중에 먹었다.,철수는저녁을나중에먹었다.
4254,철수는 저녁을 이따가 먹었다.,철수는저녁을이따가먹었다.
4255,"여보게, 자네 지금 바쁜가?","여보게,자네지금바쁜가?"
4256,"얘야, 너 지금 바쁜가?","얘야,너지금바쁜가?"
4257,우리는 햇볕에는 옷을 말렸다.,우리는햇볕에는옷을말렸다.
4258,우리는 햇볕에를 옷을 말렸다.,우리는햇볕에를옷을말렸다.
4259,학생들이 세 명이 왔다.,학생들이세명이왔다.
4260,그 학생들이 세 명이 왔다.,그학생들이세명이왔다.
4261,나의 성격은 좋다.,나의성격은좋다.
4262,나의 바다는 좋다.,나의바다는좋다.
4263,천장에 전등이 매달렸다.,천장에전등이매달렸다.
4264,천장이 전등이 매달렸다.,천장이전등이매달렸다.
4265,내일 지각할 아이에게 이것을 맡겨.,내일지각할아이에게이것을맡겨.
4266,영희가 철수에게 돈을 빼앗겼다.,영희가철수에게돈을빼앗겼다.
4267,영희가 철수에게 돈이 빼앗겼다.,영희가철수에게돈이빼앗겼다.
4268,어제 일은 죽을 쑤었다.,어제일은죽을쑤었다.
4269,어제 일은 죽을 완전히 쑤었다.,어제일은죽을완전히쑤었다.
4270,배와 사과를 가져오너라.,배와사과를가져오너라.
4271,배와 사과와 가져오너라.,배와사과와가져오너라.
4272,동생이 화분을 서재에서 안방으로 옮긴다.,동생이화분을서재에서안방으로옮긴다.
4273,동생이 서재에서 화분을 안방으로 옮긴다.,동생이서재에서화분을안방으로옮긴다.
4274,고객이 물건을 퇴짜를 놓았다.,고객이물건을퇴짜를놓았다.
4275,비가 오더니 날씨가 추워졌다.,비가오더니날씨가추워졌다.
4276,비가 오더니 날씨가 추워질 것이다.,비가오더니날씨가추워질것이다.
4277,철수가 윗도리를 벗고 공부했다. ,철수가윗도리를벗고공부했다.
4278,철수가 윗도리를 벗어 공부했다. ,철수가윗도리를벗어공부했다.
4279,할아버지가 멋있게 생기셨다.,할아버지가멋있게생기셨다.
4280,할아버지가 멋있으시게 생겼다.,할아버지가멋있으시게생겼다.
4281,김 선생님이 개가 죽었다.,김선생님이개가죽었다.
4282,김 선생님이 개가 돌아가시었다.,김선생님이개가돌아가시었다.
4283,또 술 먹었어?,또술먹었어?
4284,다시 술 먹었어?,다시술먹었어?
4285,누가 내신등급제 1세대를 미치게 하는가?,누가내신등급제1세대를미치게하는가?
4286,"내신등급제 1세대, 누가 내신등급제 1세대를 미치게 하는가?","내신등급제1세대,누가내신등급제1세대를미치게하는가?"
4287,아이들이 민요도 부르며 동요도 부르며 했다.,아이들이민요도부르며동요도부르며했다.
4288,아이들이 민요도 불렀으며 동요도 불렀으며 했다.,아이들이민요도불렀으며동요도불렀으며했다.
4289,내가 코끼리가 좋다.,내가코끼리가좋다.
4290,망치가 코끼리가 좋다.,망치가코끼리가좋다.
4291,가거나 말거나 해라.,가거나말거나해라.
4292,가거나 말아라.,가거나말아라.
4293,"소현이는 새, 헌 책을 모두 샀다.","소현이는새,헌책을모두샀다."
4294,소현이는 새와 헌 책을 모두 샀다.,소현이는새와헌책을모두샀다.
4295,나는 그녀가 몸이 약해 자주 쓰러진다는 생각이 들었다.,나는그녀가몸이약해자주쓰러진다는생각이들었다.
4296,나는 그녀가 몸이 약해 자주 쓰러진다고 하는 생각이 들었다.,나는그녀가몸이약해자주쓰러진다고하는생각이들었다.
4297,비가 오는가 보았다.,비가오는가보았다.
4298,내가 무슨 돈이 있어?,내가무슨돈이있어?
4299,나는 무슨 돈이 있어?,나는무슨돈이있어?
4300,"분명히, 그는 무뢰한이다.","분명히,그는무뢰한이다."
4301,"분명하게, 그는 무뢰한이다.","분명하게,그는무뢰한이다."
4302,순이는 학교에 안 갔다. 그러나 자주 가지 않았다.,순이는학교에안갔다.그러나자주가지않았다.
4303,사람들이 수다를 떠는 통에 주워듣게 되었다.,사람들이수다를떠는통에주워듣게되었다.
4304,사람들이 수다를 떠는 통에 주워듣자.,사람들이수다를떠는통에주워듣자.
4305,건강에 이상을 가져올 수 있으므로 식사와 운동의 균형이 중요하다.,건강에이상을가져올수있으므로식사와운동의균형이중요하다.
4306,식사와 운동의 균형이 중요하다. 건강에 이상을 가져올 수 있으므로.,식사와운동의균형이중요하다.건강에이상을가져올수있으므로.
4307,새 둥지가 절벽에 매달려 있다.,새둥지가절벽에매달려있다.
4308,새 둥지가 절벽에 매달리고 있다.,새둥지가절벽에매달리고있다.
4309,박사님의 고견을 경청하고 싶습니다.,박사님의고견을경청하고싶습니다.
4310,박사님의 고견이 경청하고 싶습니다.,박사님의고견이경청하고싶습니다.
4311,아내는 다시 강릉에 돌아갔다.,아내는다시강릉에돌아갔다.
4312,아내는 강릉에로 돌아갔다.,아내는강릉에로돌아갔다.
4313,나는 그 기회를 놓쳤음이 안타깝다.,나는그기회를놓쳤음이안타깝다.
4314,나는 그 기회가 놓쳤음이 안타깝다.,나는그기회가놓쳤음이안타깝다.
4315,나무토막과 돌덩이가 굴러 내렸다.,나무토막과돌덩이가굴러내렸다.
4316,돌덩이가 나무토막과 굴러 내렸다.,돌덩이가나무토막과굴러내렸다.
4317,울면서 떠나던 명희의 모습과 철모르고 재촉하던 그 딸의 재롱이 망막에서 사라지지 않았다.,울면서떠나던명희의모습과철모르고재촉하던그딸의재롱이망막에서사라지지않았다.
4318,철모르고 재촉하던 그 딸의 재롱이 울면서 떠나던 명희의 모습과 망막에서 사라지지 않았다.,철모르고재촉하던그딸의재롱이울면서떠나던명희의모습과망막에서사라지지않았다.
4319,의사가 와도 철수는 나아지지 않았다.,의사가와도철수는나아지지않았다.
4320,의사가 오고도 철수는 나아지지 않았다.,의사가오고도철수는나아지지않았다.
4321,전공이 국어학이 아니라 지정사가 뭔지 잘 모른다.,전공이국어학이아니라지정사가뭔지잘모른다.
4322,전공이 국어학이 아니어 지정사가 뭔지 잘 모른다.,전공이국어학이아니어지정사가뭔지잘모른다.
4323,며느리가 김치를 하느라니까 시간이 많이 걸린다.,며느리가김치를하느라니까시간이많이걸린다.
4324,며느리는 김치를 하느라니까 시간이 많이 걸린다.,며느리는김치를하느라니까시간이많이걸린다.
4325,날씨가 갑자기 추워진 것은 어제 내린 비 때문이죠?,날씨가갑자기추워진것은어제내린비때문이죠?
4326,날씨가 갑자기 추워진 것은 어제 내린 비 때문입시다.,날씨가갑자기추워진것은어제내린비때문입시다.
4327,그들은 서로 만나기를 꺼렸다.,그들은서로만나기를꺼렸다.
4328,그들은 서로 만났기를 꺼렸다.,그들은서로만났기를꺼렸다.
4329,선생님께서는 칠판에 선을 내려 그었다.,선생님께서는칠판에선을내려그었다.
4330,선생님께서는 칠판에 선을 내렸다.,선생님께서는칠판에선을내렸다.
4331,샤워를 하고 1시경에 잤다.,샤워를하고1시경에잤다.
4332,오늘 아침 소가 새끼를 깠다.,오늘아침소가새끼를깠다.
4333,오늘 아침 소가 새끼를 벗겼다.,오늘아침소가새끼를벗겼다.
4334,공사장이 무너지는 통에 사람들이 많이 다쳤겠다.,공사장이무너지는통에사람들이많이다쳤겠다.
4335,공사장이 무너지는 통에 사람들이 많이 다친다.,공사장이무너지는통에사람들이많이다친다.
4336,꽃이 피었고 새가 울었다.,꽃이피었고새가울었다.
4337,꽃이 피었고 새가 운다.,꽃이피었고새가운다.
4338,타자기를 장만한 때가 불과 며칠 전인데…,타자기를장만한때가불과며칠전인데…
4339,타자기를 장만한 사실이 불과 며칠 전인데 …,타자기를장만한사실이불과며칠전인데…
4340,수면제와 같은 약은 아주 조심해서 다뤄야 한다.,수면제와같은약은아주조심해서다뤄야한다.
4341,수면제와 서로 같은 약은 아주 조심해서 다뤄야 한다.,수면제와서로같은약은아주조심해서다뤄야한다.
4342,정부가 반대파를 처벌을 했다.,정부가반대파를처벌을했다.
4343,정부가 반대파에게 처벌을 했다.,정부가반대파에게처벌을했다.
4344,웅진이가 밥을 열심히 먹는다.,웅진이가밥을열심히먹는다.
4345,웅진이가 밥을 매우 먹는다.,웅진이가밥을매우먹는다.
4346,"놀랍게, 철수는 자기 형을 그곳에 데리고 왔다.","놀랍게,철수는자기형을그곳에데리고왔다."
4347,놀랍게는 철수는 자기 형을 그곳에 데리고 왔다.,놀랍게는철수는자기형을그곳에데리고왔다.
4348,철수가 영희의 발이 자기보다 넓다고 생각한다.,철수가영희의발이자기보다넓다고생각한다.
4349,철수가 영희의 발을 자기보다 넓다고 생각한다.,철수가영희의발을자기보다넓다고생각한다.
4350,두 사람은 편지를 주거니 받거니 했다.,두사람은편지를주거니받거니했다.
4351,두 사람은 편지를 주거니 받았다.,두사람은편지를주거니받았다.
4352,철수에게 좋은 책이 많다.,철수에게좋은책이많다.
4353,철수 좋은 책이 많다.,철수좋은책이많다.
4354,경철이는 무릎을 까는 줄도 모르고 마룻바닥을 열심히 문질렀다.,경철이는무릎을까는줄도모르고마룻바닥을열심히문질렀다.
4355,경철이는 무릎을 벗기는 줄도 모르고 마룻바닥을 열심히 문질렀다.,경철이는무릎을벗기는줄도모르고마룻바닥을열심히문질렀다.
4356,거리에 인적이 아주 사라졌다.,거리에인적이아주사라졌다.
4357,거리에 인적이 매우 사라졌다.,거리에인적이매우사라졌다.
4358,진주는 국어학을 공부하겠다고 말했다.,진주는국어학을공부하겠다고말했다.
4359,진주는 진주가 국어학을 공부하겠다고 말했다.,진주는진주가국어학을공부하겠다고말했다.
4360,도둑이 경찰에게 잡혔다.,도둑이경찰에게잡혔다.
4361,도둑이 경찰에게서 잡혔다.,도둑이경찰에게서잡혔다.
4362,나는 여기서 그냥 앉아 있고 싶다.,나는여기서그냥앉아있고싶다.
4363,나는 여기서 그냥 앉고 싶어 있다.,나는여기서그냥앉고싶어있다.
4364,철수가 나타났다.,철수가나타났다.
4365,그 물건이 좋기를 하냐?,그물건이좋기를하냐?
4366,그 물건이 좋기 하냐? 왜 샀어?,그물건이좋기하냐?왜샀어?
4367,빵이 밀가루로 만들어졌다.,빵이밀가루로만들어졌다.
4368,빵이 밀가루를 만들어졌다.,빵이밀가루를만들어졌다.
4369,두 방의 크기가 아주 같다.,두방의크기가아주같다.
4370,두 방의 크기가 매우 같다.,두방의크기가매우같다.
4371,내가 노래한다.,내가노래한다.
4372,내가 노래하신다.,내가노래하신다.
4373,나는 도서관 앞에 가려던 참이었다.,나는도서관앞에가려던참이었다.
4374,나는 도서관 앞을 가려던 참이었다.,나는도서관앞을가려던참이었다.
4375,수배자 친구들까지 고문당했다는군.,수배자친구들까지고문당했다는군.
4376,수배자 친구들까지 고문되었다는군.,수배자친구들까지고문되었다는군.
4377,차가 하는 일은 길 위에서 움직이는 것이다.,차가하는일은길위에서움직이는것이다.
4378,그는 겁도 없이 나에게 달려들었다.,그는겁도없이나에게달려들었다.
4379,배비장은 자기가 배를 앓는 체하였다.,배비장은자기가배를앓는체하였다.
4380,배비장은 배를 앓는 체 싶었다.,배비장은배를앓는체싶었다.
4381,영미가 반 대표를 되지 못했다.,영미가반대표를되지못했다.
4382,순이는 인수를 어리석게 여긴다.,순이는인수를어리석게여긴다.
4383,순이는 인수를 여긴다.,순이는인수를여긴다.
4384,진이가 우리 집 앞을 지났다.,진이가우리집앞을지났다.
4385,진이가 우리집 앞에 지났다.,진이가우리집앞에지났다.
4386,5시 약속 시간이 되어 학교 앞에 갔더니 그가 딱 나타났다.,5시약속시간이되어학교앞에갔더니그가딱나타났다.
4387,영수는 시멘트를 벽의 갈라진 틈에 조금만 메웠다.,영수는시멘트를벽의갈라진틈에조금만메웠다.
4388,영수는 시멘트로 벽의 갈라진 틈을 조금만 메웠다.,영수는시멘트로벽의갈라진틈을조금만메웠다.
4389,내 친구가 이곳에 잠이 들어 있다.,내친구가이곳에잠이들어있다.
4390,내 친구가 이곳에 잠이 들고 있다.,내친구가이곳에잠이들고있다.
4391,"물건이 싸기가 하냐, 좋기가 하냐, 편하기가 하냐?","물건이싸기가하냐,좋기가하냐,편하기가하냐?"
4392,"물건이 싸기 하냐, 좋기 하냐, 편하기 하냐? 왜 샀어?","물건이싸기하냐,좋기하냐,편하기하냐?왜샀어?"
4393,철수는 불을 껐다가 옆 사람한테 야단을 맞았다.,철수는불을껐다가옆사람한테야단을맞았다.
4394,철수가 불을 껐다가 화상을 입었다.,철수가불을껐다가화상을입었다.
4395,나는 달 밝은 밤이면 님 맞으러 가네.,나는달밝은밤이면님맞으러가네.
4396,나는 달 밝은 밤이면 님 맞으러 가는군.,나는달밝은밤이면님맞으러가는군.
4397,친지들은 그가 고향에 돌아왔음을 기뻐했다.,친지들은그가고향에돌아왔음을기뻐했다.
4398,고향이 친지들이 그가 돌아왔음을 기뻐한 곳이다.,고향이친지들이그가돌아왔음을기뻐한곳이다.
4399,"영이야, 내일 너희 집에 선생님 오시니?","영이야,내일너희집에선생님오시니?"
4400,"영이야, 내일 너희 집에 선생님 가시니?","영이야,내일너희집에선생님가시니?"
4401,"김 선생은 근본이 학자이어서, 돈과는 거리가 멀다.","김선생은근본이학자이어서,돈과는거리가멀다."
4402,"김 선생은 근본이 학자어서, 돈과는 거리가 멀다.","김선생은근본이학자어서,돈과는거리가멀다."
4403,그는 드디어 산 정상에 당도했다.,그는드디어산정상에당도했다.
4404,그는 드디어 산 정상을 당도했다.,그는드디어산정상을당도했다.
4405,철수가 거의 문을 두드렸다.,철수가거의문을두드렸다.
4406,겨울이 오면 봄이 멀지 않다.,겨울이오면봄이멀지않다.
4407,겨울은 오면 봄이 멀지 않다.,겨울은오면봄이멀지않다.
4408,이것만으로도 진위를 가릴 수 있다.,이것만으로도진위를가릴수있다.
4409,이것으로만도 진위를 가릴 수 있다.,이것으로만도진위를가릴수있다.
4410,그는 가정과 고향을 버리고 돌아다니면서 청춘을 불살랐다.,그는가정과고향을버리고돌아다니면서청춘을불살랐다.
4411,진이는 마음에서 깨끗이 욕심을 비웠다.,진이는마음에서깨끗이욕심을비웠다.
4412,기러기는 아주 높이 난다.,기러기는아주높이난다.
4413,기러기는 거의 높이 난다.,기러기는거의높이난다.
4414,비가 와서 길이 미끄럽다.,비가와서길이미끄럽다.
4415,비가 와서 길이 미끄러워서 했다.,비가와서길이미끄러워서했다.
4416,"너, 정말 그러기야?","너,정말그러기야?"
4417,"너야, 정말 그러기야?","너야,정말그러기야?"
4418,그 집이 돈이 좀 있는 편이에요.,그집이돈이좀있는편이에요.
4419,그 집이 돈이 조금 있는 편이에요.,그집이돈이조금있는편이에요.
4420,식당 안에서 폭음이 진동하고 있다.,식당안에서폭음이진동하고있다.
4421,어머니가 아이를 곱게 안았다.,어머니가아이를곱게안았다.
4422,철수는 풀이 죽어 돌아왔다.,철수는풀이죽어돌아왔다.
4423,영미가 아직 학교에 오지를 않았다.,영미가아직학교에오지를않았다.
4424,영미가 아직 학교에 오지가 않았다.,영미가아직학교에오지가않았다.
4425,그는 노래를 불러대기 전에 춤을 추었다.,그는노래를불러대기전에춤을추었다.
4426,그는 노래를 부르고 있기 전에 춤을 추었다.,그는노래를부르고있기전에춤을추었다.
4427,영희는 머리가 아프다.,영희는머리가아프다.
4428,영희에게 머리가 아프다.,영희에게머리가아프다.
4429,너는 서울에 가고 싶으냐?,너는서울에가고싶으냐?
4430,나는 서울에 가고 싶으냐?,나는서울에가고싶으냐?
4431,그는 틀림없이 범인일 것이다.,그는틀림없이범인일것이다.
4432,은수는 옷을 깨끗하게 빨았다.,은수는옷을깨끗하게빨았다.
4433,은수는 옷을 더럽게 빨았다.,은수는옷을더럽게빨았다.
4434,어렸을 때부터 영이와 철수의 사이가 좋았다.,어렸을때부터영이와철수의사이가좋았다.
4435,어렸을 때부터 사이가 좋았다.,어렸을때부터사이가좋았다.
4436,나는 집에 가야 한다고 생각했다.,나는집에가야한다고생각했다.
4437,나는 집에 가야 한다는 것을 생각했다.,나는집에가야한다는것을생각했다.
4438,이 집은 바다와 근접해 있다.,이집은바다와근접해있다.
4439,너는 떠나 버린 동역자가 슬프니?,너는떠나버린동역자가슬프니?
4440,먹다 버린 음식치고 되게 깨끗하다.,먹다버린음식치고되게깨끗하다.
4441,먹다 버린 음식치고 되게 더럽다.,먹다버린음식치고되게더럽다.
4442,세계는 이른바 세속화에로 줄달음질 쳐 왔다.,세계는이른바세속화에로줄달음질쳐왔다.
4443,세계는 이른바 세속화에 줄달음질 쳐 왔다.,세계는이른바세속화에줄달음질쳐왔다.
4444,수산시장에 가면 물건들이 더 쌀 거예요.,수산시장에가면물건들이더쌀거예요.
4445,수산시장에 가면 물건들이 더 쌀게.,수산시장에가면물건들이더쌀게.
4446,꽤 좋은 것 샀어.,꽤좋은것샀어.
4447,꽤 좋은 것 사지 그랬어.,꽤좋은것사지그랬어.
4448,무슨 일이 있어도 울지 않겠노라던 아이의 모습이 떠올랐다.,무슨일이있어도울지않겠노라던아이의모습이떠올랐다.
